Date,Heure,Lieu,Lat,Lon,Glyphe,Ton,Trecena,Emotion,Texte
"19/01/2026","","","","","Caban","10","Lamat","Confiance,Acceptation,Admiration","Aujourd'hui 13e anniversaire depuis la conception de Galiléo qui était tellement hors norme et précise que j'ai pu le noter au jour près. En même temps jour de fin du cycle CABAN de Claire. A Paris avec Thylacine à la Maison de la Radio. Je devrai recevoir cette aprem ma nouvelle carte son et un nouveau micro pour l'enregistrement du morceau de Rose. Compréhension plus profonde du fait que tout ce qui m'entoure est moi. Donc prendre le temps de comprendre et d'accueillir ces êtres qui m'énervent comme ma mère qui était là quelques jours et repart ce matin."
"24/01/2026","","","","","Ik","2","Imix","Joie,Sérénité,Extase","Corrigé l'App pour pouvoir modifier les messages. Fais le morceau de Peter Pan qui est proche de la fin pour Rose. Elle a fini sa vidéo pour la StarAc"
"25/01/2026","","","","","Akbal","3","Imix","Tristesse,Songerie,Chagrin","J'espère que l'App marche. J'ai l'impression qu'elle ne vide plus la page ici à deux heures du matin pour le nouveau jour. A tester. Je vais aller me coucher et on verra demain soir ce qu'il en est. Après le raps du soir diarrhée. Couché 23:30"
"26/01/2026","","","","","Kan","4","Imix","Tristesse,Songerie,Chagrin","Mal au ventre (diarrhée cette aprem) encore aujourd'hui. Bon film ce soir A Battle after another de P.T Anderson. Fatigué aujourd'hui... Réveillé dans la nuit vers deux heures et du mal à me rendormir derrière.
Plusieurs signes pour la reconversion en programmation... Je laisse venir."
"28/01/2026","","","","","Cimi","6","Imix","Confiance,Acceptation,Admiration","Belle journée. Accompagnée. Je crois que je vais faire cette formation de développeur python et ia. On est au collège des bernardins. Dans mon premier quartier. Juste à côté de Notre Dame pour un petit concert avec le CNSM.
J'ai commencé la formation harvard sur Python. Je crois que la transition est lancée. J'en ai parlé avec Claire et cela fait sens dans la vie. Comme un appel. Galaad arrive"
"29/01/2026","","","","","Manik","7","Imix","Joie,Sérénité,Extase","Quand je modifie le message puisque j'ai passé la soirée à coder, j'ai donc fini là vers 01:00, je découvre que c'est un de mes jours Galaad. Enorme !!!! 7 MANIK donc l'entrée dans le faire !!!"
"02/02/2026","","","","","Chuen","11","Imix","Confiance,Acceptation,Admiration","Sortie massive de files sur Epstein et ceux qui étaient avec lui. Un jour important. Pour moi une journée au CNSM et depuis hier soir un abonnement à Claude."
"03/02/2026","","","","","Eb","12","Imix","Confiance,Acceptation,Admiration","Nuit compliquée. Peu dormi. Impossible de s'endormir. Peur de ne pas me réveiller comme le premier jour de l'année. Aujourd'hui à la Radio pour Présences jusqu'à samedi. La transformation de l'App en app autonome sur Android est compliquée. J'ai donc achetée ma première API sur Kimi 2.5.
Clawdbot openclawd installé et j'ai commencé à le former. C'est complètement dingue. Du coup pas mangé ce soir et il est une heure et je ne suis pas encore couché. J'y vais !!!"
"05/02/2026","","","","","Ix","1","Ix","Joie,Sérénité,Extase","Epuisé mais superbe séance d'écriture assisté par Claude IA. Ça fuse et c'est hyper motivant. Par contre OpenClaw me déçoit pour l'instant. C'est bien mais pas au niveau de Claude et ça n'est pas évident de le liee avec d'autres choses. Je suis quand même content parce que j'ai installé une instance pour Claire et que sa dimension mémorielle va lui servir, elle qui ne connait pas ça.
Elle va encore rendre service à quelqu'un dans le besoin, sa cousine. Elle m'assure que ce coup ci elle gère, mais je m'inquiète du fait que ça ressemble a un pattern connu qui finit toujours mal."
"10/02/2026","","","","","Cauac","6","Ix","Joie,Sérénité,Extase","Grande énergie aujourd'hui !!! Plein d'entrain. J'ai avancé sur l'écriture de Léo le lion blanc et fais ma semaine de code. Openclaw m'obsède et j'essaye de voir lequel entre Claude et lui qui tourne avec Deepseek s'en sortira le mieux pour m'accompagner dans l'écriture. J'ai bossé avec l'ONF aujourd'hui avec beaucoup de joie. Cela faisait longtemps que je ''avais pas travaillé avec eux. Normalement aujourd'hui c'était le jugement pour savoir si Hélia devient Ferran ou pas. Belle discussion avec elle ce soir en rentrant du boulot.TEMPETE AU PARÉDÉ avec Eclairs qui sont tombés sur la maison : Cauac en puissance"
"18/02/2026","","","","","Manik","1","Manik","Joie,Sérénité,Extase","Retour de Claire. Magnifique l'amour que nous faisons ensemble. Réveillé à 5:00 du matin. Avec la prise de conscience qu'il faut traiter les bébés comme des anges, des dieux. Les vouvoyer. Les reconnaître. Et la beauté du nom Grand Père et Grand Mère. On y pense pas. On l'a laissé être désacralisé et pourtant. Quelle beauté !"
"25/02/2026","","","","","Ix","8","Manik","Joie,Sérénité,Extase","Nouvelle version qui ne devrait plus supprimer la note du jour quand je corrige. Je finis ma session parisienne, après un mois et demi. Fatigué, mais heureux."
"26/02/2026","","","","","Men","9","Manik","Confiance,Acceptation,Admiration","C'est le printemps. Me poser devant le soleil ☀️ et l'absorber, me nourrir de lui, sentir que le coeur est son ambassadeur ici et qu'à partir de ce centre, on fait exister le réel, on le bâtir. Et qui rien d'extérieur a ce soleil intérieur ne peut exister. Et pourtant sentir les côtes comme une prison. Rouillée. Enfermée. Comme si l'hiver avait enfermé le soleil dans la nuit. Quand je regarde le soleil dans les yeux, je vois la croix. Je vois Dieu. J'ai fini le boulot avant hier soir sur une très belle dernière journée avec Antonin à l'Opéra Comique. Beaucoup de création en dev (appli tzolkin autonome, analyse de csv détaillée assistée par llm, etc. Je fais de grands progrès et ressens la justesse d'ajouter cette corde à mon arc pour gagner beaucoup plus d'argent et faire des choses utiles pour le monde."
"27/02/2026","","","","","Cib","10","Manik","Confiance,Acceptation,Admiration","Quel merveilleux amour que nous avons fait cette nuit avec Claire. Le soleil qui se déverse sur la terre. La voie lactée et l'essence bue a ses seins. Le partage par les yeux de bien plus grand que nous. La crainte sacrée que l'on a quand on approche le sacré, la déesse. 
Plus de crédits pour continuer l'App ce matin. Après une nuit de 4:00, réveil naturel pour dire au revoir à Hélia et continuer à avancer sur l'App et les rapports générés par l'App."
